,회사명,채용공고 제목,채용공고 세부 사항,기술 세부 사항,링크
51,위메이드(WEMADE),[디스민즈워] QA 테스터(PC/Console),"경기 성남시,경력 5-18년"," 기획서 기반 테스트 설계 및 수행, QA 단계별 이슈 작성 및 트래킹, 품질 관리를 위한 다양한 게임 분석 및 의견 타진, 밸런스/플레이 테스트 기획서 기반 테스트 설계 및 수행, QA 단계별 이슈 작성 및 트래킹, 품질 관리를 위한 다양한 게임 분석 및 의견 타진, 밸런스/플레이 테스트",https://www.wanted.co.kr/wd/213911
52,삼가,Backend Developer,"서울 마포구,경력 4-8년","■ 삼가는 이렇게 일해요, 부서별로 목표를 가지고 여러 포지션의 동료들이 협업하는 목적조직 형태로 일합니다., 프로덕트에 대한 전문성과 애정을 가지고 주도적으로 일하고 있어요., 2~6주 단위의 스프린트 주기로 일하며, 프로덕트의 속도와 품질 사이 협의점을 고민하여 최선의 결과를 도출합니다., 전사 OKR을 달성하기 위해 동료들과 Why, What, How에 대한 싱크를 맞춤과 동시에, 본인의 업무에는 오너십을 가지고 몰두할 수 있어요.,,■ 삼가 개발자는 이런 일해요,삼가는 실버 산업의 전세계 리더를 꿈꾸고 있어요. 서비스를 이용하는 데이터를 기반으로 가장 좋은 서비스와 상품을 제공하기 위해 끊임없이 연구합니다., 신규 사업에 대한 서버를 설계하고 개발 및 고도화를 진행, 사용자 맞춤형 서비스를 제공하기 위한 데이터 수집 및 분석을 위한 인프라를 개발하고 운영, 제휴 및 외부 서비스 연동을 위한 API개발 및 운영, 운영하고 있는 서비스의 확장성, 안정성을 위한 방안을 고민하고 실행,,삼가에서 사용하고 있는 기술, 개발언어 : Java, node.js, 프레임워크 : Spring Framework, 데이터베이스 : Oracle, MySQL, 서버 : Tomcat, Apache, Nginx■ 삼가는 이렇게 일해요, 부서별로 목표를 가지고 여러 포지션의 동료들이 협업하는 목적조직 형태로 일합니다., 프로덕트에 대한 전문성과 애정을 가지고 주도적으로 일하고 있어요., 2~6주 단위의 스프린트 주기로 일하며, 프로덕트의 속도와 품질 사이 협의점을 고민하여 최선의 결과를 도출합니다., 전사 OKR을 달성하기 위해 동료들과 Why, What, How에 대한 싱크를 맞춤과 동시에, 본인의 업무에는 오너십을 가지고 몰두할 수 있어요.,,■ 삼가 개발자는 이런 일해요,삼가는 실버 산업의 전세계 리더를 꿈꾸고 있어요. 서비스를 이용하는 데이터를 기반으로 가장 좋은 서비스와 상품을 제공하기 위해 끊임없이 연구합니다., 신규 사업에 대한 서버를 설계하고 개발 및 고도화를 진행, 사용자 맞춤형 서비스를 제공하기 위한 데이터 수집 및 분석을 위한 인프라를 개발하고 운영, 제휴 및 외부 서비스 연동을 위한 API개발 및 운영, 운영하고 있는 서비스의 확장성, 안정성을 위한 방안을 고민하고 실행,,삼가에서 사용하고 있는 기술, 개발언어 : Java, node.js, 프레임워크 : Spring Framework, 데이터베이스 : Oracle, MySQL, 서버 : Tomcat, Apache, Nginx",https://www.wanted.co.kr/wd/209303
53,한국네트웍스,WEB시스템 운영/개발,"경기 성남시,경력 5-15년"," 그룹사(한국앤컴퍼니) WEB시스템 개발/운영,,근무조건, 근무형태 : 정규직, 근무지 : 판교 테크노밸리(경기도 성남시) , 근무시간 : 주5일, 8시 ~ 17시, 급여 : 회사내규에 따름(면접 후 결정),,전형절차, 서류전형   1차면접(코딩테스트)  인성검사  2차면접(채용검진)  처우협의(레퍼런스체크) 최종합격,※ 레퍼런스 체크는 상황에 따라 생략될 수 있음., ,접수방법, 접수 기간: 채용시 마감,※ 이력서 접수 순서대로 면접을 진행하며 우수인재 확보 시 마감, 이력서: 자유양식 (희망연봉 필수기재),,기타사항, 입사지원 서류에 허위사실이 발견될 경우, 채용확정 이후라도 채용이 취소될 수 있습니다., 지원자의 적성 및 경험을 고려하여 타 직무가 적합하다고 판단되는 경우, 지원분야가 변경될 수 있습니다.,「채용절차의 공정화에 관한 법률」 에 따라 원본으로 제출한 서류는 최종합격자 발표일부터 14일 이내 본인이 요청할 경우 반환 받을 수 있으며, 기한이 지나면 「개인정보보호법」에 따라 파기합니다. 그룹사(한국앤컴퍼니) WEB시스템 개발/운영,,근무조건, 근무형태 : 정규직, 근무지 : 판교 테크노밸리(경기도 성남시) , 근무시간 : 주5일, 8시 ~ 17시, 급여 : 회사내규에 따름(면접 후 결정),,전형절차, 서류전형   1차면접(코딩테스트)  인성검사  2차면접(채용검진)  처우협의(레퍼런스체크) 최종합격,※ 레퍼런스 체크는 상황에 따라 생략될 수 있음., ,접수방법, 접수 기간: 채용시 마감,※ 이력서 접수 순서대로 면접을 진행하며 우수인재 확보 시 마감, 이력서: 자유양식 (희망연봉 필수기재),,기타사항, 입사지원 서류에 허위사실이 발견될 경우, 채용확정 이후라도 채용이 취소될 수 있습니다., 지원자의 적성 및 경험을 고려하여 타 직무가 적합하다고 판단되는 경우, 지원분야가 변경될 수 있습니다.,「채용절차의 공정화에 관한 법률」 에 따라 원본으로 제출한 서류는 최종합격자 발표일부터 14일 이내 본인이 요청할 경우 반환 받을 수 있으며, 기한이 지나면 「개인정보보호법」에 따라 파기합니다.",https://www.wanted.co.kr/wd/214459
54,엘에스엠케이(LSMK),웹/모바일 클라이언트(React/Flutter) 개발자,"서울 송파구,경력 3-5년"," 블루멘토 서비스 웹/앱 신규 기능 개발 및 유지 보수, 자사 서비스 관련 신규 인터페이스 개발, 자사 서비스 내의 신규 프로젝트 개발, React 프레임워크를 사용하여 자사 웹 서비스 운영, Flutter를 사용하여  자사 앱 서비스 운영 및 배포 (iOS, Android),,이런 기술을 활용해요,,웹 프론트,, Typescript, React.js, Emotion, Zustand, ReactQuery, Excel.js, Github Action,,모바일 앱,, Flutter, MVVM, Riverpod, Freezed, Dio, Fastlane, Github Action 블루멘토 서비스 웹/앱 신규 기능 개발 및 유지 보수, 자사 서비스 관련 신규 인터페이스 개발, 자사 서비스 내의 신규 프로젝트 개발, React 프레임워크를 사용하여 자사 웹 서비스 운영, Flutter를 사용하여  자사 앱 서비스 운영 및 배포 (iOS, Android),,이런 기술을 활용해요,,웹 프론트,, Typescript, React.js, Emotion, Zustand, ReactQuery, Excel.js, Github Action,,모바일 앱,, Flutter, MVVM, Riverpod, Freezed, Dio, Fastlane, Github Action",https://www.wanted.co.kr/wd/214936
55,대보정보통신,시스템 연계 개발 (8년이상),"서울 강남구,경력 8-15년"," 내/외부 연계시스템 구축, 고객 요구사항 및 연관 시스템 분석, 인터페이스 분석, 설계, 구축, 테스트 등 내/외부 연계시스템 구축, 고객 요구사항 및 연관 시스템 분석, 인터페이스 분석, 설계, 구축, 테스트 등",https://www.wanted.co.kr/wd/187491
56,아이브,[100억↑투자] DevOps Engineer,"서울 서초구,경력 4-10년"," EKS 기반의 container orchestration 및 infra 구성, Microk8s 기반의 container orchestration 및 infra 구성, Kubernetes RBAC 설정 및 클라이언트 보안 구성, Terraform을 통한 IaC, Helm Chart, ArgoCD를 통한 배포, System logging 구성 및 관리, Agile Scrum을 통한 제품 개발 참여 EKS 기반의 container orchestration 및 infra 구성, Microk8s 기반의 container orchestration 및 infra 구성, Kubernetes RBAC 설정 및 클라이언트 보안 구성, Terraform을 통한 IaC, Helm Chart, ArgoCD를 통한 배포, System logging 구성 및 관리, Agile Scrum을 통한 제품 개발 참여",https://www.wanted.co.kr/wd/214285
57,브이디크럭스,솔루션 QA 담당자(3-7년),"서울 금천구,경력 3-7년","QA 담당로서 다음의 미션을 수행하게 됩니다.,, 당사 솔루션인 포스, 테이블오더, 키오스크, 어드민 프로그램에 대한 전반적인 QA 수행, 기획, 디자인 문서 기반의 테스트 설계 및 수행, 결함 보고 및 추적을 통한 품질 개선 활동, 담당 업무 프로세스 개선QA 담당로서 다음의 미션을 수행하게 됩니다.,, 당사 솔루션인 포스, 테이블오더, 키오스크, 어드민 프로그램에 대한 전반적인 QA 수행, 기획, 디자인 문서 기반의 테스트 설계 및 수행, 결함 보고 및 추적을 통한 품질 개선 활동, 담당 업무 프로세스 개선",https://www.wanted.co.kr/wd/214255
58,강남언니(힐링페이퍼),서버 개발자 (전문연구요원),"서울 강남구,경력 2-15년","＜강남언니 팀 개발자는 이렇게 일해요＞,,배우고 경험하고 성장해요,,우리는 멈추지 않고 성장하고 싶습니다. 강남언니는 '더 좋은 의료 서비스를 누구나 누릴 수 있게'라는 목표를 이루기 위해 시장의 문제를 해결해 왔습니다. 이제 그동안보다 더 크고 복잡한 문제를 해결해 나가기 위해 강남언니는 개발자를 비롯한 제품개발 조직 구성원들의 지속적인 성장이 반드시 필요하다고 판단합니다. 그러기에 강남언니 개발자는 마주한 문제를 해결하는 것 만큼이나, 해결 과정의 경험과 새로운 지식의 학습을 통해 성장을 이루려고 노력합니다.,,협업해요,,강남언니의 그 누구도 혼자서 문제를 해결하지 않습니다. 강남언니는 높은 수준의 협업을 추구합니다. 우리는 극도의 협업을 통해서만 뛰어난 팀이 만들어지며 미용의료 산업의 크고 복잡한 문제를 해결할 수 있다고 믿습니다. 강남언니 개발자는 동료 개발자, 디자이너, Product Owner와 긴밀하게 협업하며 혼자서는 풀어내기 어려운 문제들을 풀어냅니다.,,,＜우리는 이런 도구를 사용해요＞,,강남언니 팀 서버 개발자는 다음의 도구를 주로 사용해요. 그 밖에도 주어진 문제에 따라 가장 적합한 여러가지 도구를 도입합니다.,,개발 언어: Java / Kotlin,프레임워크: Spring Boot / JPA / Hibernate,데이터베이스: MySQL / MongoDB / Elasticsearch,인프라: AWS / Kubernetes,,,＜앞으로 이런 일들을 하게 될 거예요＞,, 강남언니 backend 영역 설계, 개발, 운영 리딩, 강남언니 backend System/Tech Stack 정의 및 리딩, backend 조직(Chapter) Member Teaching and Mentoring＜강남언니 팀 개발자는 이렇게 일해요＞,,배우고 경험하고 성장해요,,우리는 멈추지 않고 성장하고 싶습니다. 강남언니는 '더 좋은 의료 서비스를 누구나 누릴 수 있게'라는 목표를 이루기 위해 시장의 문제를 해결해 왔습니다. 이제 그동안보다 더 크고 복잡한 문제를 해결해 나가기 위해 강남언니는 개발자를 비롯한 제품개발 조직 구성원들의 지속적인 성장이 반드시 필요하다고 판단합니다. 그러기에 강남언니 개발자는 마주한 문제를 해결하는 것 만큼이나, 해결 과정의 경험과 새로운 지식의 학습을 통해 성장을 이루려고 노력합니다.,,협업해요,,강남언니의 그 누구도 혼자서 문제를 해결하지 않습니다. 강남언니는 높은 수준의 협업을 추구합니다. 우리는 극도의 협업을 통해서만 뛰어난 팀이 만들어지며 미용의료 산업의 크고 복잡한 문제를 해결할 수 있다고 믿습니다. 강남언니 개발자는 동료 개발자, 디자이너, Product Owner와 긴밀하게 협업하며 혼자서는 풀어내기 어려운 문제들을 풀어냅니다.,,,＜우리는 이런 도구를 사용해요＞,,강남언니 팀 서버 개발자는 다음의 도구를 주로 사용해요. 그 밖에도 주어진 문제에 따라 가장 적합한 여러가지 도구를 도입합니다.,,개발 언어: Java / Kotlin,프레임워크: Spring Boot / JPA / Hibernate,데이터베이스: MySQL / MongoDB / Elasticsearch,인프라: AWS / Kubernetes,,,＜앞으로 이런 일들을 하게 될 거예요＞,, 강남언니 backend 영역 설계, 개발, 운영 리딩, 강남언니 backend System/Tech Stack 정의 및 리딩, backend 조직(Chapter) Member Teaching and Mentoring",https://www.wanted.co.kr/wd/207040
59,피어테크(지닥),[병역특례_보충역/전직] 인프라 엔지니어,"서울 강남구,경력 1-5년"," AWS 및 GCP를 이용해 서비스 인프라를 구축 및 운영, 블록체인  노드운영, 긴급 장애 대응, 배포 업무 자동화 (github, awscli, boto3, jenkins, ElasticBeanstalk 사용), 사내 인프라 관리, 각 업무에서 정보보안 관련 작업 수행 AWS 및 GCP를 이용해 서비스 인프라를 구축 및 운영, 블록체인  노드운영, 긴급 장애 대응, 배포 업무 자동화 (github, awscli, boto3, jenkins, ElasticBeanstalk 사용), 사내 인프라 관리, 각 업무에서 정보보안 관련 작업 수행",https://www.wanted.co.kr/wd/212279
60,먼치팩토리,프로덕트 매니저,"서울 강남구,경력 3-10년","제품 관리자로서, 아워플레이스 제품 전략의 핵심 이해 관계자가 될 것입니다. 시장 조사부터 제품 개발, 출시, 평가에 이르기까지 전체 제품 수명주기를 관리하는 역할을 맡게 됩니다. 이 포지션은 Dev, Design, CX팀과 협력하여 사용자 경험을 최적화하고 비즈니스 목표를 달성하는데 필수적입니다.,, 시장조사 및 경쟁분석을 통해 제품 기회를 식별하고 우선순위를 지정합니다., 제품 전략 및 로드맵을 개발하고 실행합니다., 사용자 요구 사항을 이해하고 기능 명세서 및 사용자 스토리를 작성합니다., 개발팀과 긴밀하게 협력하여 제품 개발 일정을 관리하고, 품질 기준을 유지하며, 제품 출시를 지원합니다., 제품 성능을 모니터링하고, 사용자 피드백을 수집하며, 지속적인 개선을 위한 권장 사항을 제시합니다., 내부 팀과의 효과적인 커뮤니케이션을 통해 제품 비전과 전략을 공유합니다. , 마케팅 및 영업팀과 협력하여 제품 출시 및 프로모션 전략을 개발합니다.,,채용 과정은 서류 전형, 1차 면접(직무), 2차 면접(대표), 연봉 협상 및 입사일 조정, 그리고 최종 합격으로 이루어집니다.제품 관리자로서, 아워플레이스 제품 전략의 핵심 이해 관계자가 될 것입니다. 시장 조사부터 제품 개발, 출시, 평가에 이르기까지 전체 제품 수명주기를 관리하는 역할을 맡게 됩니다. 이 포지션은 Dev, Design, CX팀과 협력하여 사용자 경험을 최적화하고 비즈니스 목표를 달성하는데 필수적입니다.,, 시장조사 및 경쟁분석을 통해 제품 기회를 식별하고 우선순위를 지정합니다., 제품 전략 및 로드맵을 개발하고 실행합니다., 사용자 요구 사항을 이해하고 기능 명세서 및 사용자 스토리를 작성합니다., 개발팀과 긴밀하게 협력하여 제품 개발 일정을 관리하고, 품질 기준을 유지하며, 제품 출시를 지원합니다., 제품 성능을 모니터링하고, 사용자 피드백을 수집하며, 지속적인 개선을 위한 권장 사항을 제시합니다., 내부 팀과의 효과적인 커뮤니케이션을 통해 제품 비전과 전략을 공유합니다. , 마케팅 및 영업팀과 협력하여 제품 출시 및 프로모션 전략을 개발합니다.,,채용 과정은 서류 전형, 1차 면접(직무), 2차 면접(대표), 연봉 협상 및 입사일 조정, 그리고 최종 합격으로 이루어집니다.",https://www.wanted.co.kr/wd/212973
61,제네시스랩,[200억↑투자] Applied AI Scientist_Backend,"서울 중구,경력 2-10년"," AI 데이터/모델 관리 플랫폼 백엔드 개발, 대용량 데이터 관리 시스템 백엔드 개발, 데이터 접근 인증 모듈 개발, 분석결과 모니터링 시스템 백엔드 개발, 데이터 라벨링 시스템 백엔드 개발,, AI 파이프라인 플랫폼 개발, 딥러닝 추론 플랫폼 관리 시스템 백엔드 개발, 데이터 전처리 시스템 관리 시스템 백엔드 개발, 모델 학습/검증 시스템 관리 시스템 백엔드 개발 AI 데이터/모델 관리 플랫폼 백엔드 개발, 대용량 데이터 관리 시스템 백엔드 개발, 데이터 접근 인증 모듈 개발, 분석결과 모니터링 시스템 백엔드 개발, 데이터 라벨링 시스템 백엔드 개발,, AI 파이프라인 플랫폼 개발, 딥러닝 추론 플랫폼 관리 시스템 백엔드 개발, 데이터 전처리 시스템 관리 시스템 백엔드 개발, 모델 학습/검증 시스템 관리 시스템 백엔드 개발",https://www.wanted.co.kr/wd/168646
62,패스트파이브,웹 프론트엔드 개발자,"서울 강남구,경력 5-9년", 파이브스팟 서비스와 내부 관리용 페이지 설계 및 개발 파이브스팟 서비스와 내부 관리용 페이지 설계 및 개발,https://www.wanted.co.kr/wd/203422
63,제이더블유홀딩스,IT기획(프로젝트) 담당자,"경기 과천시,경력 5-15년","주요업무,1. IT 프로젝트 기획 및 관리,2. SM 등 아웃소싱 업체 관리 ,3. IT 예산 관리 및 운영을 위한 제반업무 ,,채용절차,이력서접수 서류전형  실무면접 및 AI역량검사  최종면접  채용검진  입사주요업무,1. IT 프로젝트 기획 및 관리,2. SM 등 아웃소싱 업체 관리 ,3. IT 예산 관리 및 운영을 위한 제반업무 ,,채용절차,이력서접수 서류전형  실무면접 및 AI역량검사  최종면접  채용검진  입사",https://www.wanted.co.kr/wd/214333
64,멀티캠퍼스,시스템 개발 분석/설계자,"서울 강남구,경력 3-10년"," IT시스템 (교육플랫폼) 프로젝트 관리, 요구사항 분석/ 설계,,멀티캠퍼스 동료가 되는 방법,,지원서 접수  서류 전형  실무, 인성 면접 전형 (온라인 역량검사 예정)  레퍼런스 체크  건강검진  결과 발표 IT시스템 (교육플랫폼) 프로젝트 관리, 요구사항 분석/ 설계,,멀티캠퍼스 동료가 되는 방법,,지원서 접수  서류 전형  실무, 인성 면접 전형 (온라인 역량검사 예정)  레퍼런스 체크  건강검진  결과 발표",https://www.wanted.co.kr/wd/208365
65,크리스틴컴퍼니,프론트앤드 개발자 / 2년 이상 (부산),"부산 동구,경력 2-5년","자사의 주요 서비스인 신플 솔루션의 고도화, 단계적 신규 서비스 적용을 위한 시스템을 개발합니다.,,, React를 이용한 자사 플랫폼 반응형 웹 서비스 개발자사의 주요 서비스인 신플 솔루션의 고도화, 단계적 신규 서비스 적용을 위한 시스템을 개발합니다.,,, React를 이용한 자사 플랫폼 반응형 웹 서비스 개발",https://www.wanted.co.kr/wd/214999
66,브레인커머스,[잡플래닛] Tech Lead,"서울 강남구,경력 7-20년"," 트라이브/스쿼드의 전략과 중장기 로드맵을 도출하여 실행합니다. 비즈니스 요구를 분석하여 적합한 솔루션을 제안하고 결정합니다. , 트라이브/스쿼드 내에서 필요한 기술적인 의사결정을 수행하며, 회사에 필요한 최신 기술 및 프로세스를 검토 및 도입하여 효율성을 높입니다. 기술스택과 아키텍처를 선택하고 개발표준과 가이드라인을 수립합니다., 트라이브/스쿼드 내 엔지니어에게 기술적 피드백을 제공하고, 엔지니어들의 학습 및 성장을 지원합니다., 코드 리뷰를 통해 품질을 유지하고, 코딩 표준을 적용하여 코드베이스의 일관성을 유지합니다., 기술적인 측면에서 프로젝트 일정을 관리하고 진행 상황을 모니터링합니다. 우선순위에 따라 목표를 달성하기 위한 계획을 수립하고, 프로젝트 중 발생할 수 있는 리스크를 식별하고 관리합니다., 프로젝트 진행 중 발생하는 기술적 문제에 대한 신속하고 효과적인 해결책을 제공합니다., 트라이브/스쿼드 내에서 기술적인 정보를 전달하는 것 뿐만 아니라, 비프로덕트 이해관계자들에게도 기술적 측면을 명확하게 전달합니다. 프로젝트 진행상황이나 이슈에 대해 보고하며 의사결정을 주도합니다. 트라이브/스쿼드의 전략과 중장기 로드맵을 도출하여 실행합니다. 비즈니스 요구를 분석하여 적합한 솔루션을 제안하고 결정합니다. , 트라이브/스쿼드 내에서 필요한 기술적인 의사결정을 수행하며, 회사에 필요한 최신 기술 및 프로세스를 검토 및 도입하여 효율성을 높입니다. 기술스택과 아키텍처를 선택하고 개발표준과 가이드라인을 수립합니다., 트라이브/스쿼드 내 엔지니어에게 기술적 피드백을 제공하고, 엔지니어들의 학습 및 성장을 지원합니다., 코드 리뷰를 통해 품질을 유지하고, 코딩 표준을 적용하여 코드베이스의 일관성을 유지합니다., 기술적인 측면에서 프로젝트 일정을 관리하고 진행 상황을 모니터링합니다. 우선순위에 따라 목표를 달성하기 위한 계획을 수립하고, 프로젝트 중 발생할 수 있는 리스크를 식별하고 관리합니다., 프로젝트 진행 중 발생하는 기술적 문제에 대한 신속하고 효과적인 해결책을 제공합니다., 트라이브/스쿼드 내에서 기술적인 정보를 전달하는 것 뿐만 아니라, 비프로덕트 이해관계자들에게도 기술적 측면을 명확하게 전달합니다. 프로젝트 진행상황이나 이슈에 대해 보고하며 의사결정을 주도합니다.",https://www.wanted.co.kr/wd/202592
67,알서포트(Rsupport),프론트엔드 개발자 (5년 이상),"서울 송파구,경력 5-15년","※24년 5월 경 강동구 고덕동 고덕비즈밸리 신사옥 입주예정, WebRTC 기반 프론트엔드 Application 개발 및 유지보수,#경력 기간 이하의 경우 바로 서류 탈락처리 함.※24년 5월 경 강동구 고덕동 고덕비즈밸리 신사옥 입주예정, WebRTC 기반 프론트엔드 Application 개발 및 유지보수,#경력 기간 이하의 경우 바로 서류 탈락처리 함.",https://www.wanted.co.kr/wd/197139
68,모빌린트,[200억↑투자] Deep Learning Optimization Engineer,"서울 강남구,신입-경력 20년"," Quantization, Pruning 등 딥러닝 모델 경량화 연구 및 적용, HW 최적화를 고려한 딥러닝 모델 아키텍쳐 설계 및 학습, 딥러닝 최신 연구 동향 분석 Quantization, Pruning 등 딥러닝 모델 경량화 연구 및 적용, HW 최적화를 고려한 딥러닝 모델 아키텍쳐 설계 및 학습, 딥러닝 최신 연구 동향 분석",https://www.wanted.co.kr/wd/147525
69,제이더블유홀딩스,IT기획(전략) 담당자,"경기 과천시,경력 7-15년","1. 업무 프로세스 개선을 위한 전략과제 발굴, 로드맵 수립,2. 신기술 도입 검토 및 타당성 분석,3. 대내외 커뮤니케이션 및 CLevel 보고 자료 작성1. 업무 프로세스 개선을 위한 전략과제 발굴, 로드맵 수립,2. 신기술 도입 검토 및 타당성 분석,3. 대내외 커뮤니케이션 및 CLevel 보고 자료 작성",https://www.wanted.co.kr/wd/214337
